,text,name,score,time_ms
58,arielcasas616 cossecarolina ideas amigo ideas y creo que al nuevo gobierno no le viene nada mal que alguien le prenda la luz,islote-de-la-luz&isla-de-la-luz-isleta-luz-islote-de-la-luz-luz-island-piedra-de-la-mulata-roca-de-los-pajaros-roca-de-los-pajaros,8.187,21.786
1989,bixic0me me parece raro porque ademas se fue a tomarlo a colonia desde que salis del hospital en montevideo hasta que llegas a colonia pasan un par de horas el hospital tendria que haberlo notado creo que algo de informacion esta faltando,hospital-britanico&hospital-britanico,8.057,67.913
1118,cossecarolina anteldetodos estos momentos de gran complejidad son muy complicados a esta le dan una tortuga para que la cuide y se le escapa para mi se cayo de la hamaca cuando era chica por diooooos,arroyo-de-la-tortuga&arroyo-de-la-tortuga-arroyo-de-las-tortugas-ojos-de-agua,8.051,22.387
16,uruguay para sobrellevar la cuarentena y reforzar la campana quedateentucasa este 20m tvciudaduy presenta montevideo tropical en https t co zkbznfxft3 con miriambritos en concierto disfrutalo https t co 5xmf0izh74,hogar-la-campana-fundacion-peluffo-guigens&hogar-la-campana-fundacion-peluffo-guigens,8.018,123.234
360,reportevtv el alcalde del municipio maturin wilfredoordazt da cumplimiento a la campana quedateencasa para asi evitar la propagacion del covid 19 reporta mairelysmorale1 lasolidaridadvencealcoronavirus https t co qzqrbi1wfd,hogar-la-campana-fundacion-peluffo-guigens&hogar-la-campana-fundacion-peluffo-guigens,8.018,12.857
1744,el centenario floodlight floodlightfriday flutlicht flutlichtverruckt estadiocentenario centenario montevideo uruguay uruguay footballhistory history worldcup mundial cancha futbol estadio groundhopping thechickenbaltichronicles foo https t co diy3ne8p5k https t co qtgzm0aobf,cempre-uruguay&cempre-uruguay,8.016,146.76
846,puentecelsa pregunta la imm tomo ya la decision de aplicar suspensiones en los pagos de patente contribucion impuestos y todo lo que la intendencia nos cobra por que para reclamar hay que dar el ejemplo primero o sea que las intendencias de su partido van en linea con el gno nacional,hotel-nacional&hotel-nacional,7.914,111.203
642,la intendencia de mdeo por su bajo deficit esta en mejores condiciones que el gobierno nacional para postergar vencimientos cybertario,hotel-nacional&hotel-nacional,7.914,77.532
1144,confusas las declaraciones de curutchet recien en el informativo confusas las medidas que quiso comunicar confusas en pedir mas accion de parte del gobierno nacional si hay algo q no esta previsto en el digesto se lo votamos a la montevideoim en el dia a sumar no confundir,hotel-nacional&hotel-nacional,7.914,142.701
1845,esperando las medidas solidarias de la imm respecto a los impuestos si se lo piden al gobierno nacional imagino que ya tienen pronto un paquete de medidas que nos sorprendera https t co p8h6waythv,hotel-nacional&hotel-nacional,7.914,112.639
630,dmartinez uy hagan lo mismo que el gobierno nacional es decir difieran el pago de tributos departamentales patente contribucion impuestos de puerta etc ello seria algunas de muchas medidas que podria implementar la idm para colaborar con los montevideanos ante esta grave situacion,hotel-nacional&hotel-nacional,7.914,132.995
747,cossecarolina frente amplio desde el frente amplio han hecho blableteria y demostrado que clase de oposicion son ojala el pueblo recuerde y les pase factura por esta postura tan ventajista en medio de una emergencia nacional de salud,hotel-nacional&hotel-nacional,7.914,127.693
1591,glopezsecchi cossecarolina la im no es el gobierno nacional,hotel-nacional&hotel-nacional,7.914,55.289
1072,hace un mes estan con este aviso no podran informar sobre prevencion del virus la gente ya conoce la obra que inician antes de las elecciones suspendan suba de patentes contribuciones y tributos como reclaman al gobierno nacional,hotel-nacional&hotel-nacional,7.914,90.635
638,chdica bajar las frecuencias de los bus es cuidarnos la salud que tengamos que esperar mas de lo habitual es cuidarnos la salud como siempre lo menos la im y se quejan del gobierno nacional verguenza,hotel-nacional&hotel-nacional,7.914,133.071
351,nachoabalos elojochurrinche chdica imtransito pero lo plantearon al menos sacaron un comunicado como hicieron para exigirle al gobierno nacional,hotel-nacional&hotel-nacional,7.914,75.621
290,esto es tener en claro que hacer ante una situacion como la que estamos viviendo a ver si el pnacional y luislacallepou toman nota y dejan de poner medidas a la improvisada como estan haciendo son la verguenza nacional,hotel-nacional&hotel-nacional,7.914,90.278
291,asi se observan algunas vias en el municipio palavecino hoy a 4 dias de la cuarentena nacional decretado por el pdte nicolasmaduro ante la emergencia sanitaria covid 19 lasolidaridadvencealcoronavirus quedateencasa soycomunicadorclap nicolasmaduro mirnat vies https t co iofykyy2gu,hotel-nacional&hotel-nacional,7.914,139.124
189,atlantida montevideo montevideo maldonado maldonado montevideo montevideo atlantida la cuarentena se pasa en el auto el dia de hoy,departamento-de-montevideo&departamento-montevideo-departamento-de-montevideo-montevideo,7.871,17.035
658,igalvar71 primero come no es cooperativa es s a y segundo a ver si les queda claro de una vez q cutcsa manda mas q la im siempre hace lo que se le canta siempre priorizando la plata y defecandose en el pasajero,edificio-rio-de-la-plata&edificio-rio-de-la-plata,7.847,36.478
1866,kudelais cossecarolina la plata que recauda el sindicato es descontada del sueldo de los trabajadores que estan afiliados lo mas razonable es destinar ese dinero a las personas que lo aportan cuando lo necesitan cabecita de termo,edificio-rio-de-la-plata&edificio-rio-de-la-plata,7.847,20.683
461,cossecarolina y de donde sale la plata por proponer esta bien pero no te olvides q dejaron un deficit del mas del 5 por ciento,edificio-rio-de-la-plata&edificio-rio-de-la-plata,7.847,18.253
60,cossecarolina rodequ ya que estamos planteando ridiculeces yo propongo vender el antel arena y darle la plata a los jubilados,edificio-rio-de-la-plata&edificio-rio-de-la-plata,7.847,19.892
1195,cossecarolina increible increible es la plata que te gastaste haciendo una cancha de basketball burra eso es lo increible y el clinicas se cae a pedazos,edificio-rio-de-la-plata&edificio-rio-de-la-plata,7.847,22.575
440,sacullucas99 cossecarolina del mismo lugar que sale la plata para ayudar a las empresas,edificio-rio-de-la-plata&edificio-rio-de-la-plata,7.847,13.578
429,cossecarolina tenes el atrevimiento de salir a hablar vos y el pit cnt exigen que se exonere de pagos cuando te gastaste todo en el antel arenas por tu capricho cuando jamas explicaron que hicieron con toda la plata que no aparece el pit va a dejar de cobrar la cuota sindical,edificio-rio-de-la-plata&edificio-rio-de-la-plata,7.847,28.418
1468,se entiende por que hay que hacer auditorias y por que hay q hacerlas ahora sin esperar que pase la pandemia no hay manera de saber lo q se puede encontrar y seguramente haya cosas q sirvan para afrontar la pandemia asi sea informacion que respalden las decisiones del presidente,hotel-presidente&hotel-presidente,7.806,28.654
450,cossecarolina frente amplio las inmundicias zurdas estan haciendo politica en medio de una tragedia hay que escuchar las palabras del presidente las razones de por que sube las tarifas no se puede ser tan necio hay que sumar no restar,hotel-presidente&hotel-presidente,7.806,15.785
1256,en el segmento de hoy de extranos suenos de cuarentena cossecarolina ademas de la campana para la im trabaja tambien como cazafantasmas ya la quiero ver a nuestra futura intendenta en el ecto 1 recorriendo los barrios estarcercallegarlejos nocrucenlosrayos https t co 0kefvq7wgi,hogar-la-campana-fundacion-peluffo-guigens&hogar-la-campana-fundacion-peluffo-guigens,7.795,18.453
1938,carlos patto sanchez nacio en montevideo jugo en liverpool godoy cruz river plate arg puebla monterrey de mexico y desde julio de 2018 defiende a santos de brasil con la seleccion nacional disputo el mundial de rusia 2018 https t co akz4ebpp40,hotel-nacional&hotel-nacional,7.741,421.938
717,martin bernardo lasarte arrospide nacio en montevideo uruguay el 20 de marzo de 1961 es un exfutbolista y entrenador como jugador con nacional obtuvo la copa libertadores y la copa intercontinental en 1988 su trayectoria como tecnico comienza en 1996,hotel-nacional&hotel-nacional,7.741,322.752
1410,cossecarolina cosse no ganas nada dividiendo a la gente en politica aca se precisa union y una de las cosas que dijo azuzena es que lo que mas les preocupa son las personas desempleadas no dividas mas,union&union-union,7.739,22.343
961,artesanos del mercado te invita a pasar por nuestro local para mostrarte los regalos mas lindos te esperamos en calle montevideo y sarandi https t co xvnpshkiua,punta-sarandi&punta-sarandi,7.666,24.646
951,patriciaferndez pwlrlo cossecarolina porque no se lo pedis a las intendencias del interior tambien en su mayoria son blancas de seguro van a exonerar a la gente del interior verdad,pajas-blancas&pajas-blancas-playa-pajas-blancas,7.562,28.527
564,compay hostel dr emilio frugoni 1126 montevideo uruguay a 10 minutos del estadio centenario habitaciones desde 15 dolares habitaciones con bano privado aire acondicionado parrilla reservas al 0059895446587 compay hostel es tu lugar en uruguay,cempre-uruguay&cempre-uruguay,7.531,205.055
1808,en mvd shopping https t co u4p4rz3xfy,portones-shopping&portones-shopping,7.47,11.42
675,canelonlover aca en montevideo hay una idiota ricachona empresaria que tiene fue furor xq fue a un casamiento y contagio pero no queda ahi no respeta la cuarentena ayer andaba en el shopping de los 100 cagados q se conocen 20 maso fueron contagiados x ella jebi,portones-shopping&portones-shopping,7.47,37.901
87,todonoticias el martes 17 buquebus en una actitud criminal junto todas las frecuencias incluyendo a los pasajeros que debian subir en montevideo para subir al francisco a ellos los llevaron en bus hasta colonia el francisco salio de colonia completo 1000 pasajeros que fuimos hacinados,nueva-terminal-de-pasajeros&nueva-terminal-de-pasajeros,7.453,101.198
1197,cossecarolina otro gasto de 2 000 000 millones de dolores memorial del fa ciudad de libertad sp son una porqueria https t co ngzfhidksn,villa-dolores&villa-dolores,7.451,19.523
973,aristeguionline gracias por la noticia tengo amigos q trabajan a bordo q tambien perdieron sus vuelos de vuelta a casa q eran en montevideo para los q dicen q sacaron los boletos con la epidemia no es asi se sacan con mucha anticipacion y princess cruces cancelo todo cuando salio la pandemia,tres-cruces&tres-cuces,7.436,132.433
607,cossecarolina porque en lugar de criticar no aportas ideas para la emergencia sanitaria que vive el pais porque no propones que se use el antel arena como hospital ese antel arena que curraste vos y el fa,hospital-britanico&hospital-britanico,7.363,50.334
1292,un argentino bajo del avion en montevideo venia de europa da positivo en el examen de coronavirus y se escapa del hospital de clinicas y se toma el buquebus porque todavia no cortaron los viajes fluviales luislacallepou ahora toda esa gente puede estar infectada corten todo,hospital-britanico&hospital-britanico,7.363,61.625
1061,daniel011965 lidia dupetit cossecarolina dejate de joder con tus declaraciones gastaste fortunas en el antel arena teniendo para renovar el hospital de clinicas lo que gastaste daba bien para la reforma tuvieron su oportunidad noponganpalosenlarueda tenemos memoria,hospital-britanico&hospital-britanico,7.363,64.127
1637,cossecarolina siempre aconseja hacer precisamente lo q ella no hizo se olvida q se gasto un hospital en hacer antelarena,hospital-britanico&hospital-britanico,7.363,23.702
1386,cossecarolina si una pena que se robaran los sobres costos de antel arena y no arreglaran el hospital de clinicas una pena que donaran medicinas cuando las ibamos a necesitar una pena el agujero inmenso que dejaron y eso nos deja en pesimas condiciones ahora,hospital-britanico&hospital-britanico,7.363,50.538
1636,rockmetommyboy anoche se detecto que un buquebus con 400 personas a bordo traia un pasajero con coronavirus q habiendose contagiado en europa se rajo del hospital en montevideo y se vino a bs as no nos va a matar el coronavirus lo van a hacer los irresponsables hijos de puta que tenemos,hospital-britanico&hospital-britanico,7.363,54.842
1302,draquemera viajo con el loquito que esta infectado y se escapo del hospital en montevideo,hospital-britanico&hospital-britanico,7.363,20.511
544,diegote1302 cossecarolina frente amplio hacel el anal arena de la cose de 100 millones hospital pa todos los infectados,hospital-britanico&hospital-britanico,7.363,27.073
1917,dice novaresio que segun el padre de luca el joven habia ido de madrid a p del este donde hizo cuarentena se fue a hacer ver a un hospital en montevideo le tomaron la muestra y en el interin se tomo el buquebus durante la travesia recibio un mail dicendo que era positivo,hospital-britanico&hospital-britanico,7.363,42.244
1520,acaba de publicar una foto en pocitos montevideo uruguay https t co aylungxetz,cempre-uruguay&cempre-uruguay,7.323,46.829
1848,uruguay senores,cempre-uruguay&cempre-uruguay,7.323,31.731
1781,acaba de publicar una foto en montevideo uruguay https t co 9osetccnmr,cempre-uruguay&cempre-uruguay,7.323,50.008
1960,semua pertandingan piala dunia 1930 di uruguay dimainkan di satu kota montevideo,cempre-uruguay&cempre-uruguay,7.323,47.323
731,montevideo 19 3 coronavirusenuruguay uruguay cuarentenacoronavirus montevideo https t co 7yvuqikfwh,cempre-uruguay&cempre-uruguay,7.323,49.889
1350,acaba de publicar un video en buceo montevideo uruguay https t co 3kd3hqbm3x,cempre-uruguay&cempre-uruguay,7.323,50.461
1800,en colaboracion con mdebera82 lo dibujito hicimos este horoscopos politico 2020 para que disfruten muy pronto vendran los signos que faltan en montevideo uruguay https t co gp8gzor5kk,cempre-uruguay&cempre-uruguay,7.323,77.734
1070,ante esta situacion colombia podria pedirle a uruguay explicaciones de por que el canciller talvi afirmo eso de manera tan tajante en su encuentro con la prensa anoche en montevideo es un tema muy delicado,cempre-uruguay&cempre-uruguay,7.323,78.062
1551,acaba de publicar un video en centro montevideo uruguay https t co gzohbvoinh,cempre-uruguay&cempre-uruguay,7.323,47.597
72,today s forecast for montevideo uruguay partly cloudy with a 77 chance of funnel clouds,cempre-uruguay&cempre-uruguay,7.323,51.909
7,nacionaltv1899 soy argentino hincha de river y del bolso gracias a un amigo lo sigo hace anos y voy a mi querido montevideo desde el 87 amo el uruguay vamo arriba el bolso,cempre-uruguay&cempre-uruguay,7.323,96.225
419,uruguay fitogalli anahilange diaadiavtv alvillar montevideoim https t co gc6auz3caj,cempre-uruguay&cempre-uruguay,7.323,55.979
303,canal13c nosotrosalamanana buen dia los vemos desde mvd y duele q ese estupido q entrevistaron diga el sistema de salud de uruguay es pesimo y uds no son capaces de por lo menos no inmiscuirse en pais ajeno q saben de nustros heroicos d la salud en estos momentos aclare,cempre-uruguay&cempre-uruguay,7.323,140.273
948,cossecarolina frente amplio 15 anos para hacer cosas 15 anos de robos y despilfarros hoy quieren hacer algo el covid esta hace meses en marzo recien llego a uruguay te recuerdo que ustedes eran gobierno en ese entonces antes de venir y no tomaron medidas hipocritas,cempre-uruguay&cempre-uruguay,7.323,132.552
1240,monicap75125827 alvillar que gran gesto no todo esta perdido gente arriba uruguay que con la solidaridad del pueblo de esta vamos a salir,cempre-uruguay&cempre-uruguay,7.323,65.412
1530,ignacioalcuri gracias por preferir nuestros productos en uruguay por suerte trabajamos con inspeccion vet mgap trazabilidad con inac bromatologia de la im etc etc que garantizan la confianza de los clientes y nos permite disfrutar de sus chistes,cempre-uruguay&cempre-uruguay,7.323,123.976
1182,walterh36147453 fernando amado ernesto talvi javiergarcia uy amigo estas en narnia o en el planeta tierra montevideo uruguay donde se han reprogramado todas las actividades eliminado espectaculos viajes suspendido clases etc etc ah no te enteraste de la epidemia todavia,cempre-uruguay&cempre-uruguay,7.323,129.638
1750,lahore pakistan montevideo uruguay fez morocco ankara turkey nizhny novgorod russia novosibirsk,cempre-uruguay&cempre-uruguay,7.323,52.722
1258,acaba de publicar una foto en montevideo uruguay https t co jffoe52ilh,cempre-uruguay&cempre-uruguay,7.323,44.774
1779,cielito hidalgo en montevideo uruguay https t co sbp2fg3h4d,cempre-uruguay&cempre-uruguay,7.323,45.316
214,el gobierno anterior nos sigue sorprendiendo ingratamente querian destruir una donacion de materiales que aun estan en perfectas condiciones que esto se sepa lacras hijas de puta perlitasdelfa uruguay asco coronavirusenuruguay,cempre-uruguay&cempre-uruguay,7.323,78.988
1334,giuliacandussi hey giulia im in montevideo uruguay if if you need any heelp with your parents let me know,cempre-uruguay&cempre-uruguay,7.323,55.554
1444,saludos desde montevideo uruguay comenzando otra jornada laboral al firme como todos los que aun contamos con trabajo a cuidarse y ser responsable gente,cempre-uruguay&cempre-uruguay,7.323,68.576
538,buen viernes en montevideo uruguay https t co iv1iclcuuy,cempre-uruguay&cempre-uruguay,7.323,56.489
1700,loultimo la primer persona de uruguay que contrajo el nuevo coronavirus es la disenadora de modas carmela hontou quien estuvo en milan y al regresar a montevideo asistio a un casamiento con 600 personas https t co v248kihi17,cempre-uruguay&cempre-uruguay,7.323,121.264
1614,de donde piensan que se va a sacar plata para todo eso muy irresponsables y vende humo para la gente pidiendo algo que obviamente uruguay no tiene condiciones para soportar si no hubieras tirado tantos palos verdes en el antel arena,cempre-uruguay&cempre-uruguay,7.323,85.748
238,alexi934 dcastro65 alvillar informacarve850 argentinos que residen en uruguay hay muchos y trabajan aca y alla,cempre-uruguay&cempre-uruguay,7.323,55.139
691,que se hace con los varados en uruguay que no pueden volver porque buquebus suspendio sus ultimos dos buques de repatriacion debido al infectado que viajo el jueves mi hermana estaba trabajando en montevideo y no puede volver ayuda alferdez cancilleriaarg,cempre-uruguay&cempre-uruguay,7.323,122.654
522,https t co ywmez9mjar ahora en montevideo las sesiones de fotos para ninos al alcance de todos fotografia en uruguay somos fotografos sociales expertos en fotografia de eventos tambien pregunta otros tipos de servicios de fotografia,cempre-uruguay&cempre-uruguay,7.323,119.35
694,asunto exposicion de fotografias convocatoria vi congreso de la ala del 24 al 27 de noviembre de 2020 montevideo uruguay https t co 1vswa7wm6f,cempre-uruguay&cempre-uruguay,7.323,85.539
1413,cossecarolina vieja manijera carolina todo el apoyo al gobierno a los medicos y a los uruguayos en general fuerza uruguay,cempre-uruguay&cempre-uruguay,7.323,86.027
207,20 montevideo hoy toca hablar del lugar donde vivimos yo vivo en hospitalet de llobregat este es el parque donde paseo con mi perrita ahora esta vacio por lo que todos sabemos pero los arboles nos recuerdan que https t co 6zry9angid,parque-rodo&parque-rodo,7.317,33.497
401,carolina cosse se pasa en twitter tirando veneno avisenle que falta para la campana y que tiene que empezar por ser querida dentro de su partido primero y que ademas no venga a dar clases de economia porque sus conceptos nos dejaron en la lona,hogar-la-campana-fundacion-peluffo-guigens&hogar-la-campana-fundacion-peluffo-guigens,7.284,21.751
1248,bien villar lo del smu fue totalmente irresponsable la cuarentena general debe estar todo el tiempo arriba de la mesa pero es una medida extrema por las consecuencias sociales graves que va a tener,archivo-general-de-la-nacion&archivo-general-de-la-nacion,7.169,37.361
491,majogm en montevideo el primer dia de las medidas alla todos los museos avisaron qie permaneceran cerrados hasta el 12 de abril,cerro-de-montevideo&cerro-de-montevideo-el-cerro,7.159,11.971
1760,hey montevideo uruguay it s 2 45 at yours in decimaltime,cempre-uruguay&cempre-uruguay,7.147,45.162
421,https t co z1aakhapjm animate a realizar una sesion de fotos con vestido de tus 15 anos al atardecer son las fotos mas bonitas y un perfecto recuerdo de 15 anos en montevideo organizamos tu cumpleanos de quince en uruguay foto y video para cumpleanos de 15 montevideo,cempre-uruguay&cempre-uruguay,7.147,119.333
1625,subrayado el embajador chino mas preocupado por uruguay que el mismo pompita que ayer andaba paseando por montevideo,cempre-uruguay&cempre-uruguay,7.147,64.653
384,alvmanuf cossecarolina con una mirada a mediano plazo si seguimos endeudando y sumando mas carga impositiva a las empresas no hay ser humano que invierta un peso en uruguay amigo y la verdad me gustaria ver otra cosa que no sea soja y upms,cempre-uruguay&cempre-uruguay,7.147,94.381
363,dcastro65 alvillar informacarve850 tengo una duda el gobierno dijo que hasta hoy viernes iban a venir vuelos de europa pero solo para los uruguayos y ayer los argentinos decian que en el buquebus venian mas de 100 argentinos como es eso los dejamos entrar al pais y contagiar mas a los uruguayos,europa-hotel&europa-hotel,7.138,23.358
157,faaa literal en mi trabajo esta llenito de polillas un asco trabajo en medica uruguaya jeje,cruz-roja-uruguaya&cruz-roja-uruguaya,7.124,25.734
1550,atraccion de la reina uruguaya perdible todo,cruz-roja-uruguaya&cruz-roja-uruguaya,7.124,14.863
690,cossecarolina frente amplio sobre todo cuando el jefe de estado al mando de tamana crisis nos da el ejemplo 18 de marzo 10 de la noche https t co l1hxgu0zfz,avenida-18-de-julio&avenida-18-de-julio,7.107,93.766
703,cossecarolina frente amplio sobre todo si el gobierno da el ejemplo 18 de marzo 10 de la noche https t co o5vexzgm4g,avenida-18-de-julio&avenida-18-de-julio,7.107,98.141
444,siempre al ritmo de la demagogia pura proponen medidas para un cuento de disney pero no explican como mierda llevarlas a cabo con el desastre economico que nos dejaron podemos empezar por vender el antel arena que con eso seguro tiramos por un tiempo,paso-de-la-arena&paso-de-la-arena,6.97,20.378
1860,propongo un aplauso a las 3 de la manana para agradecerle a cossecarolina por el antel arena,paso-de-la-arena&paso-de-la-arena,6.97,14.652
336,portalmvd en el diario la nacion q hizo mvd peste alli se hizo el test yno tenia sintomas le dijeron que se lo pasarianx https t co zu587jduqh fue a colonia cuando tuvo senal de internet al estar cerca de la costa recibio la confirmacion x mail y aviso a la tripulacion,colonia-nicolich&colonia-nicolich,6.9,25.954
106,alguien no entendio el mensaje o es mas preocupante para la im de osorno seguir recibiendo pagos de permisos de circulacion oficinas llenas y cero preocupacion por la pandemia lacarleta cooperativa adnradiochile 24horastvn muni osorno https t co sftnlbhgt8,edificio-de-la-cooperativa-bancaria&edificio-de-la-cooperativa-bancaria,6.897,19.86
571,mvdtransporte montevideoim con estos cambios hay mayor volumen de usuarios por unidades de trasnporte bravo aglomeracion de pasajeros mayor oportunidad de contagiarnos para los que debemos ir a trabajar,nueva-terminal-de-pasajeros&nueva-terminal-de-pasajeros,6.76,13.146
1531,el problema que por la escasez de pasajeros no estan teniendo suficiente dinero para el combustible un chofer conocido que trabaja en una de las cooperativas de transporte se anoto al seguro de paro porque la cosa viene fea es todo una caca si pero no se puede hacer mucho,nueva-terminal-de-pasajeros&nueva-terminal-de-pasajeros,6.76,14.987
159,alvillar te corrijo connie no es la peor crisis q van a enfrentar como pais es la peor que vamos a enfrentar como humanidad ya sabemos que los paises limpios estan mintiendo suelo decir que en la nave tierra todos somos tripulantes no hay pasajeros,nueva-terminal-de-pasajeros&nueva-terminal-de-pasajeros,6.76,18.889
180,el coralprincess de la armadora princesscruises fondeo frente a montevideo con 647 estadounidenses 42 argentinos 449 ingleses 208 canadienses 52 alemanes 28 chilenos y otras nacionalidades espera ordenes con la esperanza de poder desembarcar a sus pasajeros https t co 3pgipbuugl,nueva-terminal-de-pasajeros&nueva-terminal-de-pasajeros,6.76,20.606
587,lamascarada si este pibe se escapo del clinicas d montevideo viajo hasta colonia son 2 horas y pico d viaje en q fue seria mi pregunta el hospital d clinicas queda cerca d la terminal d buses interdepartamentales q hdp a cuanta gente habra expuesto,colonia-nicolich&colonia-nicolich,6.737,66.386
125,vidaagusto confinados si pero disfrutando de esa vista maravillosa gracias por compartirla desde mvdesta nona sigue cuarenteneando,bella-vista&barrio-de-bella-vista-bella-vista,6.727,10.667
1119,cossecarolina el gobierno no acuerda o el sunca y los sindicalistas no acuerdan sigue vendiendo pescado podrido senora por suerte cada vez les creen menos siga mirando todo por tv y de paso tire un twiter pidiendo las rebajas de impuestos de la imm,paso-de-la-arena&paso-de-la-arena,6.711,68.795
1370,cossecarolina cara d piedra no aclare q oscurece mejor cerra la boca inepta,piedra-redonda&piedra-redonda,6.679,15.435
1575,cossecarolina frente amplio y como lo hacemos que rostro de piedra,piedra-redonda&piedra-redonda,6.679,14.597
1363,bien chdica montevideoim el 142 de las 8 hacia pta gorda con gente parada lo han conseguido capaz que los omnibus son mas rentables hoy seguro la gente mas descartable,punta-gorda&punta-gorda,6.675,22.252
448,maxigg58 cossecarolina ahi son las 19 intendencias no el gobierno central,cementerio-central&cementerio-central,6.667,14.343
