,text,name,score,time_ms
1524,dedarvin efdmx3 buen dia creo que arbeleche al igual que daniel martinez tiene dificultades para comunicar eso no los hace incapaces ahora si dependiendo la camiseta que te pones uno puede ser capaz y la otra no estas confundido,roca-buen-viaje&buen-viaje-reef-piedras-del-buen-viaje-roca-buen-viaje-rocas-buen-viaje,4.469,15.285
1834,increible es que esta personaja tenga el tupe de opinar de un buen gobierno apoyo absoluto luislacallepou,roca-buen-viaje&buen-viaje-reef-piedras-del-buen-viaje-roca-buen-viaje-rocas-buen-viaje,4.469,10.561
1991,buen momento para vivir en montevideo y tener pedidos ya,roca-buen-viaje&buen-viaje-reef-piedras-del-buen-viaje-roca-buen-viaje-rocas-buen-viaje,4.469,8.298
524,si estuviera en montevideo le compraba 3 litros de frutillon al cecso y me agarraba buen pedo solita en mi apartamento,roca-buen-viaje&buen-viaje-reef-piedras-del-buen-viaje-roca-buen-viaje-rocas-buen-viaje,4.469,11.689
841,hace 10 minutos estoy en montevideo y ya casi me choca la guardia republicana buen dia,roca-buen-viaje&buen-viaje-reef-piedras-del-buen-viaje-roca-buen-viaje-rocas-buen-viaje,4.469,14.094
143,si muy buen razonamiento o como cuando se ofrecio para candidato a la imm que sacudio a todos de la modorra muy bien el senador manini,roca-buen-viaje&buen-viaje-reef-piedras-del-buen-viaje-roca-buen-viaje-rocas-buen-viaje,4.469,13.304
315,amagi lu elojochurrinche chdica imtransito que buen chiste https t co o9xle7d6jl,roca-buen-viaje&buen-viaje-reef-piedras-del-buen-viaje-roca-buen-viaje-rocas-buen-viaje,4.469,8.797
554,c teatendemosdesdecasa buen dia como recordinar el vuelo cancelado para el 29 4 de barcelona a montevideo pues no hay forma de poder contactar con ustedes via telefonica el bono se puede adosar a otra compania,roca-buen-viaje&buen-viaje-reef-piedras-del-buen-viaje-roca-buen-viaje-rocas-buen-viaje,4.469,53.488
628,mvdtransporte montevideoim buen dia pudiesen indicarme como puedo dentro de la aplicacion como ir encontrar el horario que tendran los omnibus,roca-buen-viaje&buen-viaje-reef-piedras-del-buen-viaje-roca-buen-viaje-rocas-buen-viaje,4.469,16.994
666,javiergarcia uy buen dia ministro el avion que llega a lima hoy y regresa a montevideo va a volver a buscar al resto de los compatriotas muchas gracias,roca-buen-viaje&buen-viaje-reef-piedras-del-buen-viaje-roca-buen-viaje-rocas-buen-viaje,4.469,13.568
693,adoracionguaman ilo buen dia desde montevideo aqui se realizo envio al seguro de desempleo primero a sectores muy tocados por la escasa movilizacion d clientes y ahora se amplio a otros grupos eso si el liberal q se quejo del estado anterior ahora no entiende porque nose posponen aumentos tarifas,roca-buen-viaje&buen-viaje-reef-piedras-del-buen-viaje-roca-buen-viaje-rocas-buen-viaje,4.469,24.301
155,susanagladysfer en montevideo portal dijeron que julio lestido no de si esta en el gobierno,escuela-no-18-noruega&escuela-no-18-noruega,4.432,52.597
277,acuerdonacional urgente 18 medidas para mitigar la crisis sanitaria,escuela-no-18-noruega&escuela-no-18-noruega,4.432,52.682
345,cossecarolina mucho de lo que plantean ya se hizo pero el resto contame como lo financiamos si el estado no tiene ni un peso y no ajustamos la tarifas porque dentro de las maravillosas 18 ideas eso no lo vi,escuela-no-18-noruega&escuela-no-18-noruega,4.432,63.058
1644,good morning montevideo sunrise 06 48 noon 12 52 sunset 18 55 utc 3 march 20 day length 12h 7m,escuela-no-18-noruega&escuela-no-18-noruega,4.432,52.582
1643,seguimos con las pruebas posicion dfc mcd mvi mvd md dc plataforma xbox one requisitos 18 y ganas de competir contactanos para probar con nosotros mercadoxbox vfo fichajes mercado vfo ayudaspro ayudasvfo ayudasvfo ayudantevfo,escuela-no-18-noruega&escuela-no-18-noruega,4.432,86.563
475,jejoraffo soyjulio3 majodevivo ponsricardo elojochurrinche fcukierman juliocesarpradi laupatbonino jecoste nestorgrajales carloscostemal1 buen dia y excelente viernes soleado por mvd un poco fresco a quedarse en casa y a apoyar al gobierno abrazo blancazo para todos https t co ldfndjaufu,roca-buen-viaje&buen-viaje-reef-piedras-del-buen-viaje-roca-buen-viaje-rocas-buen-viaje,4.333,115.767
1381,modelizacion epidemiologica del covid 19 sitio web realizado con animo academico desarrollado por el grupo de investigacion munqu del imm de la u pol valencia que publica diariamente una estimacion de la prediccion de la evolucion del covid19 en espana https t co wvt8h8z9g0,centro-cultural-de-espana-cce&centro-cultural-de-espana-cce,4.216,39.544
218,cossecarolina frente amplio carolina mas bajo no podes caer eso es bueno,bajo-forest-king&bajo-forest-king-forest-king-reef,4.212,9.936
1656,danieiatorress yo calculo que hay falta de informacion por falta de kits de deteccion actualmente estan todos en montevideo a lo sumo los casos bajo sospecha fundada que se dan en el interior los mandan a la capital asi que toy seguro que deben andar varios casos en la vuelta,bajo-forest-king&bajo-forest-king-forest-king-reef,4.212,37.951
367,espectacular lo de ose en medio de la crisis que estamos pasando y te cortan el agua,arroyo-de-la-tortuga&arroyo-de-la-tortuga-arroyo-de-las-tortugas-ojos-de-agua,4.181,9.988
185,thank you to the montevideo public school staff for all of your hard work this week i am proud of the way in which you have pulled together in support of our students and community,regency-way&regency-way,4.173,34.627
1767,mvd shopian installed plastic barricades to regulate and manage traffic smoothly at 7 places in the district a couple of one way traffic stretches will be created in the town yasinc ias muazzam4you umer rashidd shahidtaks https t co wayphhpdk6,regency-way&regency-way,4.173,35.373
921,sinduele dmartinez uy vos en serio sos tan ingenuo de creer que no pueden solventar nuestros salarios durante un mes o dos meses mas las grandes empresas posta nos toca a los trabajadores trabajar unidos cuando el poder lo tienen ellos de darnos mil facilidades se estan lavando las manos,manos-del-uruguay&manos-del-uruguay,4.158,28.651
1340,nicomatute19 cossecarolina que coraje tienen de salir con la critica destructiva porque no revisan sus procederes y tratan de evolucionar como seres humanos algunos siguen siendo larvas toda la vida hay evolucion gente anden manos a la obra,manos-del-uruguay&manos-del-uruguay,4.158,12.552
890,cossecarolina caro deja la tiradera de mierda pal mes que viene minimo llamate a silencio y lavate las manos pudris,manos-del-uruguay&manos-del-uruguay,4.158,9.778
361,20mar la etiqueta del dia lasolidaridadvencealcoronavirus aragua municipio san sebastian desde muy temprano ya las instituciones educativas activas en los comedores para realizar la comida para los ninos de sus comunidades nicolasmaduro psuvaristobulo https t co i2uhtqd07h,fundacion-ninos-con-alas&fundacion-ninos-con-alas,4.122,181.025
142,lilith 18skp partizanotano29 verotorres08 cossecarolina capaz que vos estas bien economicamente pero una buena parte de los uruguayos no necesitan seguir trabajando si estuvieramos bien 40 000 ninos no tendrian la necesidad de ir a comer a las escuelas les queres negar eso,fundacion-ninos-con-alas&fundacion-ninos-con-alas,4.122,16.109
1366,vivir una cuarentena con un agresor lleva a esto seguimos estando desprotegidas ante los agravios fisicos no quiero pensar cuantas cicatrices emocionales dejara en mujeres y ninos esta etapa de cuarentena hay quienes estan viviendo un infierno deseando que esto termine,fundacion-ninos-con-alas&fundacion-ninos-con-alas,4.122,17.289
312,cossecarolina frente amplio por favor fueron gobierno hace 20 dias ahora apoye al actual reme a favor y no venga con soluciones magicas la pandemia empezo con su gobierno y lo unico que hicieron fue donar a china kits que ibamos a necesitar que bien nos vendrian los millones del gimnasio,gimnasio-liceo-no-7-joaquin-suarez&gimnasio-liceo-ndeg-7-joaquin-suarez,4.086,24.053
425,cossecarolina nunca espere nada bueno de este gobierno se que solo gobernaran para los poderosos que dentro de poco pediran plata al fmi e intentaran privatizar lo que puedan pero la falta de humanidad que muestran en esta crisis nunca lo imagine,ciudad-del-plata&ciudad-del-plata,4.021,26.89
64,cossecarolina las propuestas son buenas algunas ya las anunciaron ayer no creo que sean aplicables todas porque no hay plata y va a haber menos,ciudad-del-plata&ciudad-del-plata,4.021,17.004
545,radiosarandi690 la imm se precipito con imponer horarios de frecuencia de domingo hay que gente que tiene que ir a trabajar de manana paradas y omnibus llenos hasta la puerta dejando gente a pie el horario debe ser sabadero la medida es por salud o por plata,ciudad-del-plata&ciudad-del-plata,4.021,56.67
787,montevideoim promocionado es decir pago haciendo campana en momento de crisis sanitaria y en camino a dificultades eoconomicas tiran plata en eso verguenza me dan,ciudad-del-plata&ciudad-del-plata,4.021,26.752
560,carve850 la imm se precipito con imponer horarios de frecuencia de domingo hay que tiene que ir a trabajar hoy de manana paradas y omnibus llenos hasta la puerta dejando gente a pie el horario debe ser sabadero la medida es x salud o x plata,ciudad-del-plata&ciudad-del-plata,4.021,36.738
562,cossecarolina frente amplio hubieran dejado un pais c plata en vez de gastar 80 palos en un horno y un estadio de 100,ciudad-del-plata&ciudad-del-plata,4.021,19.991
581,montecarlo930 la imm se precipito con imponer horarios de frecuencia de domingo hay que tiene que ir a trabajar y a la manana paradas y omnibus llenos hasta la puerta dejando gente a pie el horario debe ser sabadero la medida es por salud o por plata,ciudad-del-plata&ciudad-del-plata,4.021,37.24
259,mvddecide montevideoim yo tengo un pregunta estoy al dia con todos los tributos me pueden detallar en que miercoles gastan toda esa plata las reparaciones de calles son con prestamos internacionales casi 400 millones de dolares x ano deberiamos ser como viena y parecemos uagadugu,ciudad-del-plata&ciudad-del-plata,4.021,24.688
600,canal4 uy la imm se precipito con imponer horarios de frecuencia de domingo a la manana la hay gente que tiene que ir a trabajar paradas y omnibus llenos hasta la puerta dejando gente el horario debe ser sabadero la medida es por salud o por plata,ciudad-del-plata&ciudad-del-plata,4.021,49.971
405,montecarlo930 la imm se precipito con imponer horarios de frecuencia de domingo hay gente que tiene que ir a trabajar hoy de manana paradas y omnibus llenos hasta la puerta dejando gente a pie el horario debe ser sabadero la medida es x salud o x plata,ciudad-del-plata&ciudad-del-plata,4.021,38.418
452,asi como en chile los mismos imbeciles creen que por tener plata estan por sobre todo y todos,ciudad-del-plata&ciudad-del-plata,4.021,13.709
313,mariafer12314 cossecarolina frente amplio luislacallepou se que no te da la capacidad de razonamiento pero te explico la suba de impuestos se hace todos los anos a principio el fa para de manera sucia tirarle la responsabilidad al gobierno entrante lo pospuso tal vez si no lo hubiese hecho hoy habria algo de plata para afrontar esto,ciudad-del-plata&ciudad-del-plata,4.021,26.526
356,cossecarolina jaja son unos divinos plata para todos impuestos para nadie,ciudad-del-plata&ciudad-del-plata,4.021,13.24
1054,roccobolso cutcsaok montevideoim el problema es que cutcsa como empresa esta perdiendo mucha plata con este tema que nos afecta a todos omnibus vacios a toda hora por la ciudad perdiendo dinero no es facil por eso la resolucion con la intendencia entiendo tu malestar pero algo tenian que hacer,ciudad-del-plata&ciudad-del-plata,4.021,32.184
1943,cossecarolina frente amplio y con que plata xq si es por proponer yo puedo proponer que se les pague el sueldo a todos mientras esten en cuarentena pero caundo me pregunten como yo les diga no se problema del gob contribuyan con los como tambien no solo los quiero tal cosa,ciudad-del-plata&ciudad-del-plata,4.021,26.008
971,cossecarolina avisame cuando la im deja de cobrar la patente y contribucion o el impuesto de puerta etc gastaste 110 millones en un estadio de basquet que en realidad salia 40 un disparate igual para la crisis que deja tu fa la regasificadora los 900 millones para tapar ancap etc etc,edificio-puerta-del-sol&edificio-puerta-del-sol,3.977,22.675
625,canal 12 la imm se precipito con imponer horarios de domingo hay gente que tiene que ir a trabajar y a las 7 y 9 de la manana paradas y omnibus llenos hasta la puerta dejando gente a pie el horario debe ser sabadero para que la gente pueda viajar y sentado es por salud o plat,edificio-puerta-del-sol&edificio-puerta-del-sol,3.977,40.23
1443,flordejunco pedi q la imm no cobre x este ano ni patentes impuesto de puerta y contribucion,edificio-puerta-del-sol&edificio-puerta-del-sol,3.977,10.065
270,gonzacivila frente amplio no habra llegado el momento de que la montevideoim posponga pagos de contribucion patente e impuesto a la puerta,edificio-puerta-del-sol&edificio-puerta-del-sol,3.977,10.318
281,cossecarolina frente amplio y porque no empiezan por donde pueden definirlo ustedes que es la intendencia esa a la que sos candidata eliminen 2 cuotas de la contribucion 4 de impuestos de puerta y 3 cuotas de patente de rodados es facil pedir a los demas lo que uno no hace se llama hipocresia,edificio-puerta-del-sol&edificio-puerta-del-sol,3.977,16.0
955,lhermida01 chinofau frente amplio cossecarolina el taba tiene responsabilidad en esto es culpable como medico heroe de la salud no sabia que esta pandemia estaba atras de la puerta todavia desabastecido el pais a menos de un mes de la llegada del coronavirus dando importante cantidad de insumos hospitalarios,edificio-puerta-del-sol&edificio-puerta-del-sol,3.977,25.629
1493,pedimos a la montevideoim que tenga sensibilidad con los ciudadanos y no cobre los impuestos de puerta y las patente a vehiculos de trabajo ya que por la emergencia no se trabaja ni se circula frente amplio batllistas uy coloybatllistas lahittecarlos antoniojung1959,edificio-puerta-del-sol&edificio-puerta-del-sol,3.977,20.031
871,rosse6446 hablamos de imm en razon del doble discurso del frente amplio de su doble moral el gran problema hoy es la falta de recursos que tiene el estado para afrontar la crisis sanitaria instalada y la economica en puerta cortesia del despilfarro del f a,edificio-puerta-del-sol&edificio-puerta-del-sol,3.977,25.842
501,cossecarolina frente amplio pensar que el mef libero 50 millones de dolares para creditos de montones de pequenas empresas y unipersonales que lastima hubieran sido 150 millones pero es mejor tener el antel arena ni te digo con lo de raulito y con todo lo que se curro en los ultimos anos,paso-de-la-arena&paso-de-la-arena,3.946,22.347
543,cossecarolina frente amplio capaz que no haciendo esta mierda ahorrabamos 2 millones de dolares ni que hablar del antel arena https t co x3fhl67frf,paso-de-la-arena&paso-de-la-arena,3.946,15.893
287,lictricolor2 cossecarolina seguramente no es muy util pero mucho mas util serian los 20 antel arena que se tiraron y se van a seguir tirando en subvencionar jubilaciones de milicos,paso-de-la-arena&paso-de-la-arena,3.946,16.368
171,cossecarolina frente amplio te quemaste 100 palos en el antel arena ayer el esfuerzo del brou sera por 50 con un maximo a todo trapo de 125 no entendes que sos impresentable flaca,paso-de-la-arena&paso-de-la-arena,3.946,15.248
1832,cossecarolina las vidas q salvariamos con el dinero del antel arena espero q x lo menos sirva de refugio,paso-de-la-arena&paso-de-la-arena,3.946,11.617
1712,cossecarolina illuminatimtvo sos una fantasma dedicate hacer castillos de arena,paso-de-la-arena&paso-de-la-arena,3.946,10.494
263,cossecarolina q hiciste con los millones del antel arena ahora hacen falta,paso-de-la-arena&paso-de-la-arena,3.946,10.818
1426,cossecarolina rol del estado si es guardar para situaciones como la que estamos atravesando algo que sus prioridades y sus ejecuciones presupuestales no permitieron no nos olvidamos del antel arena,paso-de-la-arena&paso-de-la-arena,3.946,13.01
370,cossecarolina a pero tenemos antel arena reverenda hdp sos es increible como te burlas de los uruguayos es por esto que como mujer me da verguenza la cuota politica,paso-de-la-arena&paso-de-la-arena,3.946,20.217
610,cossecarolina sigue la sra veneno que despilfarro mill de u en el arena restando con sus comentarios ya que no construye no siga destruyendo estamos en una pandemia todos tenemos q sumar,paso-de-la-arena&paso-de-la-arena,3.946,12.11
611,cossecarolina que bueno que usaste nuestro dinero para construirte el antel arena increible faraona cosse sos de lo peor dejate de arengar hace cuarentena verbal y nos haces un favor a todos,paso-de-la-arena&paso-de-la-arena,3.946,14.808
127,cossecarolina frente amplio te quemaste 100 palos en el antel arena el esfuerzo anunciado ayer de prestamo blandia del brou sera por 50 con un maximo a todo trapo de 125 no entendes que sos impresentable flaca,paso-de-la-arena&paso-de-la-arena,3.946,19.583
641,cossecarolina que util que es el antel arena en este momento https t co oymrfgg9jr,paso-de-la-arena&paso-de-la-arena,3.946,11.374
118,cossecarolina frente amplio te quemaste 100 palos en el antel arena el esfuerzo de prestamos del brou con intereses blandos anunciados ayer sera por 50 con un maximo a todo trapo de 125 no entendes que sos impresentable flaca,paso-de-la-arena&paso-de-la-arena,3.946,16.096
1428,cossecarolina que lastima que todo lo que nos hizo gastar en el antel arena no lo ahorraron para enfrentar esta crisis sanitarias deberias por respeto permanecer callada la boca,paso-de-la-arena&paso-de-la-arena,3.946,14.163
1425,cossecarolina si usted hubiera tenido conducta tendriamos mas dinero en caja ni hablar del antel arena que hoy no sirve para nada https t co z7cayxfqvb,paso-de-la-arena&paso-de-la-arena,3.946,15.341
247,cossecarolina que dice senora llamese al silencio que falta nos hacen los millones de dolares metidos en un antel arena innecesario,paso-de-la-arena&paso-de-la-arena,3.946,28.769
71,elpredicador cossecarolina frente amplio hay que utilizar el antel arena para albergar a la gente en situacion de calle,paso-de-la-arena&paso-de-la-arena,3.946,11.892
985,cossecarolina y sigue con la manija senora por favoooooooorrrrrrr lo suyo fue una gran irresponsabilidad al gastar lo que gasto en el antel arena como esta siendo ahora una irresponsabilidad dar manija como si ustedes no hubiese n tenido nada que ver con sa situacion actual,paso-de-la-arena&paso-de-la-arena,3.946,27.715
1096,cossecarolina frente amplio cosse estamos esperando la declaracion por el costo inicial del antel arena en 45 mm hoy 120 mm y toda la izquierda mira a la derecha cri cri,paso-de-la-arena&paso-de-la-arena,3.946,18.705
1242,cossecarolina una pena lo que gastaron en antel arena regasificadora ancap sin ninguna prevision eso me da pena a usted,paso-de-la-arena&paso-de-la-arena,3.946,14.045
1112,cossecarolina una lastima que hiciste el antel arena en vez de guardar el dinero para emergencias como esta burra,paso-de-la-arena&paso-de-la-arena,3.946,12.43
702,cossecarolina frente amplio redireccionar gastos jajajajjaja 100 palos tiraste a la basura con el antel arena de mierda vieja careta,paso-de-la-arena&paso-de-la-arena,3.946,18.358
1297,cossecarolina cien millones comprendes la realidad dormi tranquila si los ctis se quedan sin camas llevas a los enfermos a ver que lindas las plantitas del antel arena,paso-de-la-arena&paso-de-la-arena,3.946,14.511
55,no se en montevideo aca en solymar mi zona pocos aplaudieron yo aplaudi con fuerza x mi hijo mayor y todos lo medicos del clinicas que entregan su vida cada dia con enorme sacrificio lo mismo que enfermeras aux de servicios y personal a todos los que trabajan en la salud gracias,hospital-de-clinicas-doctor-manuel-quintela-udelar&hospital-de-clinicas-doctor-manuel-quintela-udelar,3.935,27.2
535,las mujeres mueren de formas sospechosas en ciertos ambitos y su pareja se queda con el cuerpo muerto con una bolsa plastica en la cabeza por 48 horas y despues avisa,bolsa-de-valores-montevideo&bolsa-de-valores-montevideo,3.925,12.78
150,grazianopascale guidomaninirios luislacallepou manini es un estratega me saco el sombrero esta es su 2da intervencion la prinera fue en prsentarse como candidato a la imm un genio el general,archivo-general-de-la-nacion&archivo-general-de-la-nacion,3.911,67.431
128,grazianopascale guidomaninirios luislacallepou e gral manini es un estratega me saco el sombrero chapeau esta es su 2da intervencion la primera fue cusndo se presento como posible candidato a la imm un genio el general,archivo-general-de-la-nacion&archivo-general-de-la-nacion,3.911,245.967
1076,cossecarolina corrija su titular senora deje de vender pescado podrido https t co doz5ab2ol5,parroquia-nuestra-senora-de-lourdes&parroquia-nuestra-senora-de-lourdes,3.902,11.878
1682,camboue cossecarolina que atrevida no tiene verguenza esta senora,parroquia-nuestra-senora-de-lourdes&parroquia-nuestra-senora-de-lourdes,3.902,10.144
1339,cossecarolina ahora se dieron cuenta de eso senora despues que despilfarraron durante 10 los recursos que les vino de regalo e hicieron barbaridades como esta y dejaron solo 100 kits para combatir el virus https t co 1lehhz8wlk,parroquia-nuestra-senora-de-lourdes&parroquia-nuestra-senora-de-lourdes,3.902,16.504
1321,cossecarolina ahora se dieron cuenta de eso senora despues que despilfarraron durante 10 anos el gigantesco crecimiento que les vino de regalo e hicieron barbaridades como esta y dejaron solo 100 kits para combatir el virus https t co mve7hogpof,parroquia-nuestra-senora-de-lourdes&parroquia-nuestra-senora-de-lourdes,3.902,17.755
970,cossecarolina se cae el pais y esta senora que dejo los entes fundidos tiene el tupe de dar manija politica por un pais unido esta je tura debe desaparecer de la politica,parroquia-nuestra-senora-de-lourdes&parroquia-nuestra-senora-de-lourdes,3.902,20.643
1467,cossecarolina como dije ayer senora dejese de hacer politica barata y preocupece por el bien del pais una ves ya que esta pasando por momentos dificil gracias a la desastrosa politica que hicieron ustedes y que le quede claro a usted y al sunca que el fa ya no esta mas,parroquia-nuestra-senora-de-lourdes&parroquia-nuestra-senora-de-lourdes,3.902,24.908
25,cossecarolina alftuitea oiga senora no cree usted q si ustedes hubieran dejado las empresas publicas en condiciones no seris necesario aumentar las tarifas no se pienso capas estoy equivocado y el aumento d tarifas no le correspondis al fa https t co p5q5cl94ap,parroquia-nuestra-senora-de-lourdes&parroquia-nuestra-senora-de-lourdes,3.902,21.956
1743,rommelrios mas adelante habla con mas detalles de lo que paso en montevideo,paso-molino&paso-molino-paso-del-molino,3.89,20.719
1433,cossecarolina si uds fueron tan crack porque el 61 no los voto no entendiste lo que paso todavia la unica cosa buena que ha sucedido es que uds no estan mas en el gbno iban a terminar de destrozar el pais desde el olimpo corrupto e iluminado que gbnaban este gbno es la mejor noticia,paso-molino&paso-molino-paso-del-molino,3.89,54.246
1360,canal 4 saeta y teledoce hicieron una campana en conjunto con sus figuras centrales de los informativos pero no participaron tnu tv ciudad ni vtv que paso https t co fml6kuvwiy,paso-molino&paso-molino-paso-del-molino,3.89,35.372
1536,alvillar que genios y solidarios esto necesitamos en la vida grandes recuerdos del maciel y milton el mejor enfermero de la emergencia pocos con su vocacion y dedicacion,baliza-muelle-a-maciel&muelle-a-light,3.874,13.52
1583,cossecarolina cinica queres que bajen el iva y unos 300 pesos de la ute y 50 del agua el gobierno prefiere cobrarnos eso a todos y aumentar partidas mides y subsidiar las pymes ya calculaste cuantas cuotas de 300 de ute pagariamos con lo que derrochaste en el aarena,arroyo-de-la-tortuga&arroyo-de-la-tortuga-arroyo-de-las-tortugas-ojos-de-agua,3.856,23.763
191,al fin ya tenemos al hombre indicado para acabar con el covid 19 con su gran equipo como son fabigoyen cossecarolina gera nunez1001 danielgerhard5 ultima temporada altafachauy igalvar71 jhgatti s magliano martinp39777865 pitcnt1 observadoruy elpaisuy https t co kjpbr9bwwo,gran-hotel-america&gran-hotel-america,3.853,16.937
1605,mientras la gran mayoria de los uruguayos entienden lo dificil del momento y la responsabilidad que ello conlleva hay dirigentes como carolina cosse cuya superficialidad y frivolidad queda nuevamente de manifiesto https t co lvxnrbxq8k,gran-hotel-america&gran-hotel-america,3.853,12.53
1770,cossecarolina dona sepa que no se negocia con ladrones que roban trabajadores el pit como defensor de los trabajadores sale mas caro que el mejor abogado del pais una gran cantidad de zanganos currando sin trabajar que los trabajadores les reclamen a ellos por lo que aportan,gran-hotel-america&gran-hotel-america,3.853,17.36
1282,me parece muy buena idea tambien seria una gran ayuda en este momento,gran-hotel-america&gran-hotel-america,3.853,9.664
431,hoy nos toca vivir una situacion de emergencia sanitaria de la cual solo saldremos todos juntos la semana pasada comenzamos a detener nuestras actividades de campana porque es momento de estar unidos sea cual sea nuestra bandera trabajando con mucho foco saldremos adelante https t co bhdzbsfszy,hogar-la-campana-fundacion-peluffo-guigens&hogar-la-campana-fundacion-peluffo-guigens,3.821,22.805
319,elisalieber vegavanetito las preguntas mas acertadas las hacen los de tv ciudad los siguen en campana,hogar-la-campana-fundacion-peluffo-guigens&hogar-la-campana-fundacion-peluffo-guigens,3.821,8.067
898,cossecarolina increible es ver lo miserable que sos te importa un pito el pais seguis en campana,hogar-la-campana-fundacion-peluffo-guigens&hogar-la-campana-fundacion-peluffo-guigens,3.821,10.947
